{
  "$schema": "./schema.json",
  "header": "// This file is generated by opi. Do not edit.",
  "jsdoc": true,
  "readonly": true,
  "single_quote": true,
  "formats": {
    "binary": "Blob"
  },
  "filter": {
    "include": null,
    "exclude": null
  },
  "schemas": {
    "emit": "referenced",
    "keep": []
  },
  "operation": {
    "name": "{Method}{Path}",
    "params": "split",
    "response": "by_content_type",
    "no_content_key": "none"
  },
  "emit": [
    {
      "name": "Paths",
      "description": null,
      "kind": "map",
      "key": [
        "{path}",
        "{method}"
      ],
      "value": null,
      "group_by": null
    }
  ]
}